<?xml version="1.0" encoding="UTF-8" standalone="yes"?>
<database xmlns:xsi="http://www.w3.org/2001/XMLSchema-instance" xsi:schemaLocation="app/data/database.xsd">
    <cabbies>
        <cabbie>
            <name>Martina</name>
            <cabbieId>95faf849-c28b-4c8f-af0a-1179f70e5504</cabbieId>
            <rating>2.375</rating>
            <phone>+55 47 94567-8901</phone>
            <email>isabela.ferreira@email.com</email>
            <licenseNumber>StUvWxYz</licenseNumber>
            <status>false</status>
        </cabbie>
    </cabbies>
    <passengers>
        <passenger>
            <name>Estevão</name>
            <passengerId>ed952f8c-f8f6-4cea-99f3-da0df48e0915</passengerId>
            <phone>+55 13 91234-5678</phone>
            <email>tiago.silva@email.com</email>
        </passenger>
    </passengers>
    <ridePayments>
        <ridePayment>
            <paymentId>bd2d9fbb-6870-4cb7-87d6-b7785c7d0387</paymentId>
            <rideId>b071038e-a51a-416c-8c1d-9e2b7cb8e638</rideId>
            <rideDistance>8.06</rideDistance>
            <amount>25.6</amount>
            <rideStartTime>2024-10-13T15:46:15.415329100</rideStartTime>
            <paymentMethod>CARTÃODECRÉDITO</paymentMethod>
        </ridePayment>
        <ridePayment>
            <paymentId>a352c4bc-50e3-4311-bc2c-42662c819e53</paymentId>
            <rideId>716565f1-9333-4883-a10b-411841d072ed</rideId>
            <rideDistance>15.29</rideDistance>
            <amount>64.8</amount>
            <rideStartTime>2024-10-13T15:46:18.000411700</rideStartTime>
            <paymentMethod>PIX</paymentMethod>
        </ridePayment>
    </ridePayments>
    <rides>
        <ride>
            <rideId>b071038e-a51a-416c-8c1d-9e2b7cb8e638</rideId>
            <passengerId>ed952f8c-f8f6-4cea-99f3-da0df48e0915</passengerId>
            <cabbieId>95faf849-c28b-4c8f-af0a-1179f70e5504</cabbieId>
            <vehicleId>6ef81f2a-53e8-48f0-bfec-eef327d05b75</vehicleId>
            <pickupLocation>SHOPPING</pickupLocation>
            <dropLocation>ESTACAODETREM</dropLocation>
            <rideDistance>8.06</rideDistance>
            <status>finalizada</status>
            <startTime>2024-10-13T15:46:15.415329100</startTime>
        </ride>
        <ride>
            <rideId>b071038e-a51a-416c-8c1d-9e2b7cb8e638</rideId>
            <passengerId>ed952f8c-f8f6-4cea-99f3-da0df48e0915</passengerId>
            <cabbieId>95faf849-c28b-4c8f-af0a-1179f70e5504</cabbieId>
            <vehicleId>6ef81f2a-53e8-48f0-bfec-eef327d05b75</vehicleId>
            <pickupLocation>SHOPPING</pickupLocation>
            <dropLocation>ESTACAODETREM</dropLocation>
            <rideDistance>8.06</rideDistance>
            <status>finalizada</status>
            <startTime>2024-10-13T15:46:15.415329100</startTime>
        </ride>
        <ride>
            <rideId>716565f1-9333-4883-a10b-411841d072ed</rideId>
            <passengerId>ed952f8c-f8f6-4cea-99f3-da0df48e0915</passengerId>
            <cabbieId>95faf849-c28b-4c8f-af0a-1179f70e5504</cabbieId>
            <vehicleId>6ef81f2a-53e8-48f0-bfec-eef327d05b75</vehicleId>
            <pickupLocation>PARQUE</pickupLocation>
            <dropLocation>BIBLIOTECA</dropLocation>
            <rideDistance>15.29</rideDistance>
            <status>em corrida</status>
            <startTime>2024-10-13T15:46:18.000411700</startTime>
        </ride>
    </rides>
    <vehicles>
        <vehicle>
            <vehicleId>6ef81f2a-53e8-48f0-bfec-eef327d05b75</vehicleId>
            <registrationNumber>ABD123</registrationNumber>
            <cabbieId>95faf849-c28b-4c8f-af0a-1179f70e5504</cabbieId>
            <model>Volkswagen</model>
            <year>2015</year>
        </vehicle>
    </vehicles>
</database>
