<?xml version="1.0" encoding="UTF-8" standalone="yes"?>
<database xmlns:xsi="http://www.w3.org/2001/XMLSchema-instance" xsi:schemaLocation="app/data/database.xsd">
    <cabbies>
        <cabbie>
            <name>Martina</name>
            <cabbieId>3bfbdfac-a916-4611-befd-51384e9e9c1b</cabbieId>
            <rating>3.25</rating>
            <phone>+55 85 93456-7890</phone>
            <email>felipe.oliveira@email.com</email>
            <licenseNumber>L6mNopQr</licenseNumber>
            <status>false</status>
        </cabbie>
    </cabbies>
    <passengers>
        <passenger>
            <name>Estevão</name>
            <passengerId>f4a69956-2775-4456-bf33-4656079f83ee</passengerId>
            <phone>+55 27 92345-6789</phone>
            <email>sofia.almeida@email.com</email>
        </passenger>
    </passengers>
    <ridePayments>
        <ridePayment>
            <paymentId>7d4a9cc8-f16d-45b0-8ccb-43c24682fe29</paymentId>
            <rideId>d1307759-906e-4509-9372-dbcda00eb26b</rideId>
            <rideDistance>8.06</rideDistance>
            <amount>30.93</amount>
            <rideStartTime>2024-10-07T21:07:08.240062500</rideStartTime>
            <paymentMethod>CARTÃODECRÉDITO</paymentMethod>
        </ridePayment>
        <ridePayment>
            <paymentId>8dcdc763-9740-4d07-9557-37061dc5945b</paymentId>
            <rideId>b509a47d-867e-4b84-b3bc-bf08da2a6583</rideId>
            <rideDistance>15.29</rideDistance>
            <amount>73.53</amount>
            <rideStartTime>2024-10-07T21:07:10.240483700</rideStartTime>
            <paymentMethod>PIX</paymentMethod>
        </ridePayment>
    </ridePayments>
    <rides>
        <ride>
            <rideId>d1307759-906e-4509-9372-dbcda00eb26b</rideId>
            <passengerId>f4a69956-2775-4456-bf33-4656079f83ee</passengerId>
            <cabbieId>3bfbdfac-a916-4611-befd-51384e9e9c1b</cabbieId>
            <vehicleId>2abefd0c-35c8-4b7b-adaf-50030280d5d2</vehicleId>
            <pickupLocation>SHOPPING</pickupLocation>
            <dropLocation>ESTAÇÃODETREM</dropLocation>
            <rideDistance>8.06</rideDistance>
            <status>finalizada</status>
            <startTime>2024-10-07T21:07:08.240062500</startTime>
        </ride>
        <ride>
            <rideId>d1307759-906e-4509-9372-dbcda00eb26b</rideId>
            <passengerId>f4a69956-2775-4456-bf33-4656079f83ee</passengerId>
            <cabbieId>3bfbdfac-a916-4611-befd-51384e9e9c1b</cabbieId>
            <vehicleId>2abefd0c-35c8-4b7b-adaf-50030280d5d2</vehicleId>
            <pickupLocation>SHOPPING</pickupLocation>
            <dropLocation>ESTAÇÃODETREM</dropLocation>
            <rideDistance>8.06</rideDistance>
            <status>finalizada</status>
            <startTime>2024-10-07T21:07:08.240062500</startTime>
        </ride>
        <ride>
            <rideId>b509a47d-867e-4b84-b3bc-bf08da2a6583</rideId>
            <passengerId>f4a69956-2775-4456-bf33-4656079f83ee</passengerId>
            <cabbieId>3bfbdfac-a916-4611-befd-51384e9e9c1b</cabbieId>
            <vehicleId>2abefd0c-35c8-4b7b-adaf-50030280d5d2</vehicleId>
            <pickupLocation>PARQUE</pickupLocation>
            <dropLocation>BIBLIOTECA</dropLocation>
            <rideDistance>15.29</rideDistance>
            <status>em corrida</status>
            <startTime>2024-10-07T21:07:10.240483700</startTime>
        </ride>
    </rides>
    <vehicles>
        <vehicle>
            <vehicleId>2abefd0c-35c8-4b7b-adaf-50030280d5d2</vehicleId>
            <registrationNumber>ABD123</registrationNumber>
            <cabbieId>3bfbdfac-a916-4611-befd-51384e9e9c1b</cabbieId>
            <model>Hyundai</model>
            <year>2008</year>
        </vehicle>
    </vehicles>
</database>
